{
  "contract_version": "0.1.0",
  "backend": {
    "platform": "linux",
    "name": "networkmanager-dbus",
    "backend_version": "0.1.0"
  },
  "interfaces": [
    {
      "id": "synthetic0",
      "name": "Synthetic Wi-Fi adapter",
      "driver": null,
      "state": "100"
    }
  ],
  "error": null
}
